{
  "version": 1,
  "grid": {"columns": 4, "rows": 3, "gap": 10},
  "keys": {
    "home": "page:1",
    "up": "prev_page",
    "down": "next_page"
  },
  "pages": [
    {
      "name": "Home",
      "cards": [
        {"type": "clock", "w": 2},
        {"type": "weather", "entity_id": "weather.home", "w": 2},
        {"type": "light", "entity_id": "light.kitchen", "label": "Kitchen"},
        {"type": "light", "entity_id": "light.living_room", "label": "Living Room", "icon": "mdi:floor-lamp"},
        {"type": "switch", "entity_id": "switch.coffee_maker", "label": "Coffee", "icon": "mdi:coffee"},
        {"type": "switch", "entity_id": "input_boolean.guest_mode", "label": "Guests", "icon": "mdi:account"},
        {"type": "scene", "entity_id": "scene.movie_night", "label": "Movie Night", "icon": "mdi:television"},
        {"type": "script", "entity_id": "script.good_night", "label": "Good Night", "icon": "mdi:bed"},
        {"type": "sensor", "entity_id": "sensor.living_room_temperature", "label": "Living Room", "precision": 1},
        {"type": "sensor", "entity_id": "sensor.living_room_humidity", "label": "Humidity", "precision": 0}
      ]
    },
    {
      "name": "Outside",
      "columns": 3,
      "rows": 2,
      "cards": [
        {"type": "light", "entity_id": "light.porch", "label": "Porch", "icon": "mdi:outdoor-lamp", "x": 0, "y": 0},
        {"type": "sensor", "entity_id": "weather.home", "attribute": "wind_speed", "unit": "km/h", "label": "Wind", "icon": "mdi:weather-windy"},
        {"type": "light", "entity_id": "light.garden", "label": "Garden", "tap": {"action": "light.turn_on", "data": {"brightness_pct": 50}}},
        {"type": "switch", "entity_id": "switch.sprinkler", "label": "Sprinkler", "icon": "mdi:sprinkler", "w": 3}
      ]
    },
    {
      "name": "More",
      "cards": [
        {"type": "cover", "entity_id": "cover.garage_door", "label": "Garage"},
        {"type": "climate", "entity_id": "climate.living_room", "label": "Thermostat", "step": 0.5},
        {"type": "media_player", "entity_id": "media_player.kitchen_speaker", "label": "Kitchen", "w": 2},
        {"type": "fan", "entity_id": "fan.bedroom", "label": "Bedroom Fan", "hold": "none"},
        {"type": "conditional", "entity_id": "binary_sensor.front_door", "state": "on",
         "card": {"type": "switch", "entity_id": "switch.porch_light", "label": "Porch Light", "icon": "mdi:outdoor-lamp"}}
      ]
    },
    {
      "name": "Sliders",
      "cards": [
        {"type": "slider", "entity_id": "light.kitchen", "label": "Kitchen", "w": 2},
        {"type": "slider", "entity_id": "media_player.kitchen_speaker", "label": "Kitchen Volume", "w": 2},
        {"type": "slider", "entity_id": "cover.living_room_blinds", "label": "Blinds", "orientation": "vertical", "h": 2},
        {"type": "slider", "entity_id": "fan.bedroom", "label": "Bedroom Fan", "send": "drag"},
        {"type": "slider", "entity_id": "input_number.washer_delay", "label": "Washer Delay", "min": 0, "max": 12, "unit": "h", "w": 2}
      ]
    }
  ]
}
